--------------------------------------------------------------------------------------------------------
SV_ASSISTANT Report                                                            
--------------------------------------------------------------------------------------------------------
Level      1 Instruction Cache size:32KB 8way 64linesize 64 set 1 partition   
Hardware Report Specific                                                                            
--------------------------------------------------------------------------------------------------------
CPU                                                                            
--------------------------------------------------------------------------------------------------------
CPU Name:           ZhaoXin Core i5 
CPU Core:           6                             
CPU Threads:        8                             
                           
Level 1 DataCache size:32KB 8way 64linesize 64 set 1 partition                                     
Level 2 size:256KB 8way 64linesize 512 set 1 partition                                              
Level 3 size:6144MB 12way 64linesize 8192 set 1 partition                                           
Package Temperature:47 ??C                        
Core1 Temperature:47 ??C                                                                            
Core2 Temperature:46 ??C                                                                            
Core3 Temperature:47 ??C                                                                            
Core4 Temperature:45 ??C                                                                            
CPU SocketDesignation:Unknown                       
Southbridge Name:   Z87                           
CPU Manufacture:    GenuineIntel                  
Code Name:          Haswell                       
CPU Specification:  Intel(R) Core(TM) i5-4460  CPU @ 3.20GHz
Family:             6                             
Model:              12                            
Stepping:           3                             
ExtFamily:          6                             
ExtModel:           60                            
Revision:           15363                         
Technology:         22                            
InstructionSet:     SSE3 PCLMULQDQ DTES64 MONITOE DS_CPL VMX EIST TM2 SSSE3 SDBG FMA CMPXCHG16B xTPR_Update_Control PDCM PCID SSE4_1 SSE4_2 x2APIC MOVBE POPCNT TSC_Deadline AESNI XSAVE OSXSAVE AVX F16C RDRAND
Core 0 Speed:       3292.36                       
Core 0 Speed:       3292.36                       
Core 0 Speed:       3292.36                       
Core 0 Speed:       3192.59                       
Ext Speed:          99.7684                       
Multiplier:         33                            
Multiplier:         33                            
Multiplier:         33                            
Multiplier:         32                            
Processor ID:       BFEBFBFF000306C3              
Max TDP:            0                             
Memory                                                                         

--------------------------------------------------------------------------------------------------------

Dimm Num:           4                             

Slot:               16  0                           
Module Type:        DDR3 UDIMM                    
Module Size:        8                             
Module Manufacture: Crucial Technology            
DRAM Manufacture:   Micron Technology             
Part Num:           BLT8G3D1608ET3LX0.            
Serial Num:         A10E4FD4                      
Product Date:                                     

Slot:               162                           
Module Type:        DDR3 UDIMM                    
Module Size:        8                             
Module Manufacture: Crucial Technology            
DRAM Manufacture:   Micron Technology             
Part Num:           BLT8G3D1608ET3LX0.            
Serial Num:         AD02B576                      
Product Date:                                     

Slot:               164                           
Module Type:        DDR3 UDIMM                    
Module Size:        8                             
Module Manufacture: Crucial Technology            
DRAM Manufacture:   Micron Technology             
Part Num:           BLT8G3D1608ET3LX0.            
Serial Num:         AD02B542                      
Product Date:                                     

Slot:               166                           
Module Type:        DDR3 UDIMM                    
Module Size:        8                             
Module Manufacture: Crucial Technology            
DRAM Manufacture:   Micron Technology             
Part Num:           BLT8G3D1608ET3LX0.            
Serial Num:         AD02B574                      
Product Date:                                     

GFX                                                                            
--------------------------------------------------------------------------------------------------------
GPU Name:                     Nvidia GeForce GT 720         
GPU BIOS Version:             80.28.56.00.01                
GPU Driver Version:           33266                         
GPU Branch Version:           r331_00                       
Temperature:                  43                            
GPU Clock:                    0                             
GPU Memory:                   0                             
Usage:                        0                             
Fans:                         0                             
Dedicated Video Memory:       1048576                       
System Video Memory:          0                             
Shared System Memory:         3146044                       

Monitor                                                                        
--------------------------------------------------------------------------------------------------------
Name:               Philips Consumer Electronics Company PHL 258B6QJEB
EDID ( Extended Display Identification Data) Report #1
	Vendor / Product Identification
            Manufacture:                            PHL
            Monitor Serial Number :                 15402
            Product Code:                           000008E9
            Week/Year:                              19/2016
            Version:                                1.3
    Video input parameters bitmap
            Digital input
            Bit depth:                              Undefined
            Video interface:                        Undefined
            Max Horizontal Image Size:              55cn
            Max Vertical Image Size:                31cn
            Gamma:                                  2.2
    FeatureSupport:
            Standby:                                No
            Suspend:                                No
            Active off:                             Yes
            standby:                                No
            Preferred timing mode specified:        Yes
            Continuous timings with GTF or CVT:     No
    Color Characteristic:
            Red:                              X = 0.689453	Y = 3
            Red:                              X = 0.21875	Y = 3
            Red:                              X = 0.149414	Y = 3
            Red:                              X = 0.313477	Y = 3
    Established Timings:
            720x400 @ 70 Hz 
            640x480 @ 60 Hz 
            640x480 @ 67 Hz 
            640x480 @ 72 Hz 
            640x480 @ 75 Hz 
            800x600 @ 60 Hz 
            800x600 @ 75 Hz 
            1024x768 @ 60 Hz 
            1024x768 @ 75 Hz 
            1280x1024 @ 75 Hz 
    Standard Timing #0
            1920 x 1200 @ 60Hz
    Standard Timing #1
            1280 x 800 @ 60Hz
    Standard Timing #2
            1280 x 800 @ 60Hz
    Standard Timing #3
            1440 x 900 @ 75Hz
    Standard Timing #4
            1440 x 900 @ 60Hz
    Standard Timing #5
            1680 x 1050 @ 60Hz
    Standard Timing #6
            1280 x 800 @ 60Hz
    Standard Timing #7
          Unused
    Detailed Timing Descriptor:
        Pixel Clock:            241.5Mhz
        Horizontal active:          2560pixels
        Horizontal blanking:        160pixels
        Vertical  active:           1440pixels
        Vertical  blanking:         41pixels
        Horizontal sync. offset:    48pixels
        Horizontal sync. width:     32pixels
        Vertical sync. offset:      5pixels
        Vertical sync. width:       3pixels
        Horizontal Image Size:      553 mm
        Vertical Image Size:        311mm
        Horizontal Border:          0pixels
        Vertical Border:            0lines
    Display serial number Descriptor:
        Display serial number:                          UHB1619015402
    Display name Descriptor:
        Display name number:                          PHL 258B6QJEB
    Display Range Limits Descriptor:
        Min. Horizontal rate:                       15khz
        Max. Horizontal rate:                       99khz
        Min. Vertical rate:                         23khz
        Max. Vertical rate:                         76khz
        Max. Pixel Clock:                           300Mhz

Disk                                                                           
--------------------------------------------------------------------------------------------------------
Nominal Media Rotation Rate:  7200 RPM                      
Buffer Size:                                                
Nv Cache Size:                                              
Logical Drive:                E: J:                         
Power On Count:               1366 Counts                   
Temperature:                  34 ¡ãC                         
Host Writes:                                                
Host Reads:                                                 
GBytesErased:                                               
Nand Writes:                                                
Power On Hours:               3999 Hours                    
Total Disk Size:              1000.2 GB                     
Serial Number:                Z4Y19VCY                      
Firmware Rev:                 CC45                          
Model:                        ST1000DM003-1ER162            
Max Transfer Mode:            SATA/600                      
Current Transfer Mode:        SATA/600                      
Major Version:                ACS-2                         
Minor Version:                ACS-3 Revision 3b             
Interface:                    Serial ATA                    
Enclosure:                                                  
Device Nominal Form Factor:   3.5 inch                      
Feature:                      S.M.A.R.T., APM, NCQ          
Disk State:                                                 

Nominal Media Rotation Rate:  (SSD)                         
Buffer Size:                                                
Nv Cache Size:                                              
Logical Drive:                C:                            
Power On Count:               9976 Counts                   
Temperature:                  39 ¡ãC                         
Host Writes:                  39.822 TB                     
Host Reads:                                                 
GBytesErased:                                               
Nand Writes:                                                
Power On Hours:               11105 Hours                   
Total Disk Size:              120.0 GB                      
Serial Number:                S21VNXBG894109J               
Firmware Rev:                 EMT01B6Q                      
Model:                        Samsung SSD 850 EVO 120GB     
Max Transfer Mode:            SATA/600                      
Current Transfer Mode:        SATA/600                      
Major Version:                ACS-2                         
Minor Version:                ATA8-ACS version 4c           
Interface:                    Serial ATA                    
Enclosure:                                                  
Device Nominal Form Factor:                                 
Feature:                      S.M.A.R.T., NCQ, TRIM, DevSleep
Disk State:                                                 

USB                                                                            
--------------------------------------------------------------------------------------------------------
  [Standard Enhanced PCI to USB Host Controller]
          DriverKey: {36fc9e60-c465-11cf-8056-444553540000}\0000
          VendorID: 8086
          DeviceID: 8C26
          SubSysID: 5B71028
          Revision: 5
          Bus.Device.Function (in hex): 0.1D.0
          Host Controller Power State Mappings
          System State       Host Controller     Root Hub        USB wakeup      Powered
     Port 0 Generic USB Hub
               Is Port User Connectable:         no
               Is Port Debug Capable:            no
               Is Port TypeC:                    no
               Companion Port Number:            0
               Companion Hub Symbolic Link Name: 
               Protocols Supported:              
                USB 1.1:                         no
                USB 2.0:                         no
                USB 3.0:                         no
               
                            Hub Power:                        
               Bus Powered
                 Hub Type:                        
               ERROR: Unknown hub type
               Number of Ports:                  0
               High speed capable:               yes
               High speed:                       yes
               Multiple transaction translations capable:    no
               Performs multiple transaction translations simultaneously:    no
               Hub wakes when device is connected:   no
               Hub is bus powered:               no
               Hub is root:                      no
               
                                    ---===>Device Information<===---
                         ===>Device Descriptor<===
               bLength:                           18
               bDescriptorType:                   1
               bcdUSB:                            512
               bDeviceClass:                      9
               bDeviceSubClass:                   0
               bDeviceProtocol:                   1
               bMaxPacketSize0:                   64
               idVendor:                          32903
               idProduct:                         32768
               bcdDevice:                         5
               iManufacturer:                     0
               iProduct:                          0
               iSerialNumber:                     0
               bNumConfigurations:                1
                          ---===>Full Configuration Descriptor<===---
                         ===>Configuration Descriptor<===
               bLength:                           9
               bDescriptorType:                   2
               wTotalLength:                      25
               bNumInterfaces:                    1
               bConfigurationValue:               1
               iConfiguration:                    0
               bmAttributes:                      224
               MaxPower:                          0
                         ===>Interface Descriptor<===
               bLength:                           9
               bDescriptorType:                   4
               bInterfaceNumber:                  0
               bAlternateSetting:                 0
               bNumEndpoints:                     1
               bInterfaceClass:                   9
               bInterfaceSubClass:                0
               bInterfaceProtocol:                0
               iInterface:                        0
                         ===>Endpoint Descriptor<===
               bLength:                           7
               bDescriptorType:                   5
               bEndpointAddress:                  129
               bmAttributes:                      3
               wMaxPacketSize:                    2
               bInterval:                         12
          Port 1                        Is Port User Connectable:         no
                    Is Port Debug Capable:            no
                    Is Port TypeC:                    no
                    Companion Port Number:            0
                    Companion Hub Symbolic Link Name: 
                    Protocols Supported:              
                     USB 1.1:                         no
                     USB 2.0:                         no
                     USB 3.0:                         no
                    
                                      ConnectionStatus:                 NoDeviceConnected
          Port 2                        Is Port User Connectable:         no
                    Is Port Debug Capable:            no
                    Is Port TypeC:                    no
                    Companion Port Number:            0
                    Companion Hub Symbolic Link Name: 
                    Protocols Supported:              
                     USB 1.1:                         no
                     USB 2.0:                         no
                     USB 3.0:                         no
                    
                                      ConnectionStatus:                 NoDeviceConnected
          Port 3                        Is Port User Connectable:         no
                    Is Port Debug Capable:            no
                    Is Port TypeC:                    no
                    Companion Port Number:            0
                    Companion Hub Symbolic Link Name: 
                    Protocols Supported:              
                     USB 1.1:                         no
                     USB 2.0:                         no
                     USB 3.0:                         no
                    
                                      ConnectionStatus:                 NoDeviceConnected
          Port 4                        Is Port User Connectable:         no
                    Is Port Debug Capable:            no
                    Is Port TypeC:                    no
                    Companion Port Number:            0
                    Companion Hub Symbolic Link Name: 
                    Protocols Supported:              
                     USB 1.1:                         no
                     USB 2.0:                         no
                     USB 3.0:                         no
                    
                                      ConnectionStatus:                 NoDeviceConnected
          Port 5                        Is Port User Connectable:         no
                    Is Port Debug Capable:            no
                    Is Port TypeC:                    no
                    Companion Port Number:            0
                    Companion Hub Symbolic Link Name: 
                    Protocols Supported:              
                     USB 1.1:                         no
                     USB 2.0:                         no
                     USB 3.0:                         no
                    
                                      ConnectionStatus:                 NoDeviceConnected
          Port 6                        Is Port User Connectable:         no
                    Is Port Debug Capable:            no
                    Is Port TypeC:                    no
                    Companion Port Number:            0
                    Companion Hub Symbolic Link Name: 
                    Protocols Supported:              
                     USB 1.1:                         no
                     USB 2.0:                         no
                     USB 3.0:                         no
                    
                                      ConnectionStatus:                 NoDeviceConnected
          Port 7                        Is Port User Connectable:         no
                    Is Port Debug Capable:            no
                    Is Port TypeC:                    no
                    Companion Port Number:            0
                    Companion Hub Symbolic Link Name: 
                    Protocols Supported:              
                     USB 1.1:                         no
                     USB 2.0:                         no
                     USB 3.0:                         no
                    
                                      ConnectionStatus:                 NoDeviceConnected
          Port 8                        Is Port User Connectable:         no
                    Is Port Debug Capable:            no
                    Is Port TypeC:                    no
                    Companion Port Number:            0
                    Companion Hub Symbolic Link Name: 
                    Protocols Supported:              
                     USB 1.1:                         no
                     USB 2.0:                         no
                     USB 3.0:                         no
                    
                                      ConnectionStatus:                 NoDeviceConnected
     Port 1               Is Port User Connectable:         no
               Is Port Debug Capable:            no
               Is Port TypeC:                    no
               Companion Port Number:            0
               Companion Hub Symbolic Link Name: 
               Protocols Supported:              
                USB 1.1:                         no
                USB 2.0:                         no
                USB 3.0:                         no
               
                            ConnectionStatus:                 NoDeviceConnected
  [Standard Enhanced PCI to USB Host Controller]
          DriverKey: {36fc9e60-c465-11cf-8056-444553540000}\0001
          VendorID: 8086
          DeviceID: 8C2D
          SubSysID: 5B71028
          Revision: 5
          Bus.Device.Function (in hex): 0.1A.0
          Host Controller Power State Mappings
          System State       Host Controller     Root Hub        USB wakeup      Powered
     Port 0 Generic USB Hub
               Is Port User Connectable:         no
               Is Port Debug Capable:            no
               Is Port TypeC:                    no
               Companion Port Number:            0
               Companion Hub Symbolic Link Name: 
               Protocols Supported:              
                USB 1.1:                         no
                USB 2.0:                         no
                USB 3.0:                         no
               
                            Hub Power:                        
               Bus Powered
                 Hub Type:                        
               ERROR: Unknown hub type
               Number of Ports:                  0
               High speed capable:               yes
               High speed:                       yes
               Multiple transaction translations capable:    no
               Performs multiple transaction translations simultaneously:    no
               Hub wakes when device is connected:   no
               Hub is bus powered:               no
               Hub is root:                      no
               
                                    ---===>Device Information<===---
                         ===>Device Descriptor<===
               bLength:                           18
               bDescriptorType:                   1
               bcdUSB:                            512
               bDeviceClass:                      9
               bDeviceSubClass:                   0
               bDeviceProtocol:                   1
               bMaxPacketSize0:                   64
               idVendor:                          32903
               idProduct:                         32776
               bcdDevice:                         5
               iManufacturer:                     0
               iProduct:                          0
               iSerialNumber:                     0
               bNumConfigurations:                1
                          ---===>Full Configuration Descriptor<===---
                         ===>Configuration Descriptor<===
               bLength:                           9
               bDescriptorType:                   2
               wTotalLength:                      25
               bNumInterfaces:                    1
               bConfigurationValue:               1
               iConfiguration:                    0
               bmAttributes:                      224
               MaxPower:                          0
                         ===>Interface Descriptor<===
               bLength:                           9
               bDescriptorType:                   4
               bInterfaceNumber:                  0
               bAlternateSetting:                 0
               bNumEndpoints:                     1
               bInterfaceClass:                   9
               bInterfaceSubClass:                0
               bInterfaceProtocol:                0
               iInterface:                        0
                         ===>Endpoint Descriptor<===
               bLength:                           7
               bDescriptorType:                   5
               bEndpointAddress:                  129
               bmAttributes:                      3
               wMaxPacketSize:                    1
               bInterval:                         12
          Port 1                        Is Port User Connectable:         no
                    Is Port Debug Capable:            no
                    Is Port TypeC:                    no
                    Companion Port Number:            0
                    Companion Hub Symbolic Link Name: 
                    Protocols Supported:              
                     USB 1.1:                         no
                     USB 2.0:                         no
                     USB 3.0:                         no
                    
                                      ConnectionStatus:                 NoDeviceConnected
          Port 2                        Is Port User Connectable:         no
                    Is Port Debug Capable:            no
                    Is Port TypeC:                    no
                    Companion Port Number:            0
                    Companion Hub Symbolic Link Name: 
                    Protocols Supported:              
                     USB 1.1:                         no
                     USB 2.0:                         no
                     USB 3.0:                         no
                    
                                      ConnectionStatus:                 NoDeviceConnected
          Port 3                        Is Port User Connectable:         no
                    Is Port Debug Capable:            no
                    Is Port TypeC:                    no
                    Companion Port Number:            0
                    Companion Hub Symbolic Link Name: 
                    Protocols Supported:              
                     USB 1.1:                         no
                     USB 2.0:                         no
                     USB 3.0:                         no
                    
                                      ConnectionStatus:                 NoDeviceConnected
          Port 4                        Is Port User Connectable:         no
                    Is Port Debug Capable:            no
                    Is Port TypeC:                    no
                    Companion Port Number:            0
                    Companion Hub Symbolic Link Name: 
                    Protocols Supported:              
                     USB 1.1:                         no
                     USB 2.0:                         no
                     USB 3.0:                         no
                    