Is Port User Connectable:         no
Is Port Debug Capable:            no
Is Port TypeC:                    no
Companion Port Number:            0
Companion Hub Symbolic Link Name: 
Protocols Supported:              
 USB 1.1:                         no
 USB 2.0:                         no
 USB 3.0:                         no

        ---===>Device Information<===---
          ===>Device Descriptor<===
bLength:                           18
bDescriptorType:                   1
bcdUSB:                            272
bDeviceClass:                      224
bDeviceSubClass:                   1
bDeviceProtocol:                   1
bMaxPacketSize0:                   64
idVendor:                          3315
idProduct:                         57348
bcdDevice:                         1
iManufacturer:                     1
           String Descriptor not available
iProduct:                          2
           String Descriptor not available
iSerialNumber:                     3
           String Descriptor not available
bNumConfigurations:                1
           ---===>Full Configuration Descriptor<===---
          ===>Configuration Descriptor<===
bLength:                           9
bDescriptorType:                   2
wTotalLength:                      177
bNumInterfaces:                    2
bConfigurationValue:               1
iConfiguration:                    4
           
bmAttributes:                      224
MaxPower:                          50
          ===>Interface Descriptor<===
bLength:                           9
bDescriptorType:                   4
bInterfaceNumber:                  0
bAlternateSetting:                 0
bNumEndpoints:                     3
bInterfaceClass:                   224
bInterfaceSubClass:                1
bInterfaceProtocol:                1
iInterface:                        0
          ===>Endpoint Descriptor<===
bLength:                           7
bDescriptorType:                   5
bEndpointAddress:                  129
bmAttributes:                      3
wMaxPacketSize:                    16
bInterval:                         1
          ===>Endpoint Descriptor<===
bLength:                           7
bDescriptorType:                   5
bEndpointAddress:                  130
bmAttributes:                      2
wMaxPacketSize:                    64
bInterval:                         1
          ===>Endpoint Descriptor<===
bLength:                           7
bDescriptorType:                   5
bEndpointAddress:                  2
bmAttributes:                      2
wMaxPacketSize:                    64
bInterval:                         1
          ===>Endpoint Descriptor<===
bLength:                           7
bDescriptorType:                   5
bEndpointAddress:                  131
bmAttributes:                      1
wMaxPacketSize:                    0
bInterval:                         1
          ===>Endpoint Descriptor<===
bLength:                           7
bDescriptorType:                   5
bEndpointAddress:                  3
bmAttributes:                      1
wMaxPacketSize:                    0
bInterval:                         1
